{"empty_tables":["tenants","ledger_command_log","ledger_entity","ledger_meta","outbox_events"],"format":"ir-initialized-workspace-verification-v1","idempotency_key":"synthetic-request-default","policy_sha256":"e16d685a5ecf8892b51491ba240b89a18c4b22b3ff58b847b13a795327ee3395","readiness":{"artifact_verified":true,"operational":false,"policy_initialized":true,"storage_initialized":true,"workspace_reopened":true},"scaffold_sha256":"dbb3702d3dfd38f1c59ac4a2e14872dd6b7580f1bb99936885b7afd174336fed","state_sha256":"f18ebcf44fbb82a1febe3ae8a227028fa7395f2f88b692d8875d77a4d8cbe5c2","storage_scope":"sql-scaffold-empty-tables-v1","tenant_id":"org_synthetic_portable"}